{
  "$schema": "https://registry.phlohouse.com/schema/support/v1.json",
  "manifest_schema": "phlo.support.v1",
  "schema_version": "1.0",
  "release_line": "1.x",
  "artifact_pinning": "not_yet_published",
  "current_release": {
    "version": "0.19.0",
    "maturity": "alpha",
    "production_ready": false
  },
  "release_set": {
    "packages": [
      {"name": "phlo", "version": "0.19.0"},
      {"name": "phlo-api", "version": "0.19.0"},
      {"name": "phlo-core-plugins", "version": "0.16.2"},
      {"name": "phlo-dagster", "version": "0.19.0"},
      {"name": "phlo-dbt", "version": "0.18.0"},
      {"name": "phlo-dlt", "version": "0.18.0"},
      {"name": "phlo-iceberg", "version": "0.18.0"},
      {"name": "phlo-minio", "version": "0.18.0"},
      {"name": "phlo-nessie", "version": "0.18.0"},
      {"name": "phlo-observatory", "version": "0.19.0"},
      {"name": "phlo-observe-plugin", "version": "0.2.2"},
      {"name": "phlo-pandera", "version": "0.16.2"},
      {"name": "phlo-postgres", "version": "0.18.0"},
      {"name": "phlo-trino", "version": "0.18.0"}
    ],
    "services": [
      {"name": "dagster", "image_reference": "ghcr.io/phlohouse/phlo-dagster:0.19.0"},
      {"name": "dagster-daemon", "image_reference": "ghcr.io/phlohouse/phlo-dagster:0.19.0"},
      {"name": "postgres", "image_reference": "postgres:18.4-alpine3.24@sha256:9a8afca54e7861fd90fab5fdf4c42477a6b1cb7d293595148e674e0a3181de15"},
      {"name": "postgres-volume-setup", "image_reference": "alpine:3.24.1@sha256:28bd5fe8b56d1bd048e5babf5b10710ebe0bae67db86916198a6eec434943f8b"},
      {"name": "minio", "image_reference": "ghcr.io/phlohouse/phlo-minio:0.17.2"},
      {"name": "minio-volume-setup", "image_reference": "alpine:3.24.1@sha256:28bd5fe8b56d1bd048e5babf5b10710ebe0bae67db86916198a6eec434943f8b"},
      {"name": "minio-setup", "image_reference": "ghcr.io/phlohouse/phlo-minio:0.17.2"},
      {"name": "nessie", "image_reference": "ghcr.io/projectnessie/nessie:0.108.3@sha256:219709df809fcfac7abe0491b2070c8d56178ed29828fb30968a4365b62bcc8a"},
      {"name": "trino", "image_reference": "trinodb/trino:483@sha256:db58cc93e593a2706553745f276bb119c9810e69918be56ecde088ba7ccb0534"},
      {"name": "phlo-api", "image_reference": "ghcr.io/phlohouse/phlo-api:0.19.0"},
      {"name": "observatory", "image_reference": "ghcr.io/phlohouse/phlo-observatory:0.19.0"}
    ],
    "schemas": {
      "configuration": {
        "version": "1",
        "source": "src/phlo/config/settings.py"
      },
      "database": {
        "version": "5",
        "source": "src/phlo/run_evidence/models.py"
      }
    }
  },
  "profiles": {
    "blessed_core": {
      "status": "scope-frozen",
      "components": [
        "package:phlo",
        "package:phlo-api",
        "package:phlo-core-plugins",
        "package:phlo-dagster",
        "package:phlo-dbt",
        "package:phlo-dlt",
        "package:phlo-iceberg",
        "package:phlo-minio",
        "package:phlo-nessie",
        "package:phlo-observatory",
        "package:phlo-observe-plugin",
        "package:phlo-pandera",
        "package:phlo-postgres",
        "package:phlo-trino",
        "service:dagster",
        "service:dagster-daemon",
        "service:postgres",
        "service:postgres-volume-setup",
        "service:minio",
        "service:minio-volume-setup",
        "service:minio-setup",
        "service:nessie",
        "service:trino",
        "service:phlo-api",
        "service:observatory",
        "capability:iceberg_tables",
        "capability:nessie_branch_write_audit_publish",
        "capability:dlt_ingestion",
        "capability:dbt_transformations",
        "capability:pandera_quality",
        "capability:observatory_run_report",
        "capability:mandatory_authorization",
        "capability:secure_production_deployment",
        "capability:maintenance_operations",
        "capability:upgrade_restore",
        "capability:golden_path_ci"
      ],
      "reason": "This is the v1 target scope; target support is separate from current alpha maturity and release-gate readiness."
    },
    "supported_optional": {
      "status": "target_capabilities_only",
      "components": [
        "package:phlo-alerting",
        "package:phlo-hasura",
        "package:phlo-lineage",
        "package:phlo-oauth2-proxy",
        "package:phlo-otel",
        "package:phlo-postgrest",
        "package:phlo-sling",
        "package:phlo-traefik",
        "service:hasura",
        "service:postgrest",
        "service:oauth2-proxy",
        "service:traefik",
        "service:traefik-docker"
      ],
      "reason": "These optional packages have current code and focused tests, but identity, ingress, or production gates still apply."
    },
    "preview": {
      "status": "available_without_v1_guarantee",
      "components": [
        "package:phlo-airbyte",
        "package:phlo-alloy",
        "package:phlo-clickhouse",
        "package:phlo-clickstack",
        "package:phlo-delta",
        "package:phlo-grafana",
        "package:phlo-kafka",
        "package:phlo-loki",
        "package:phlo-mcp",
        "package:phlo-openmetadata",
        "package:phlo-polaris",
        "package:phlo-prometheus",
        "package:phlo-rustfs",
        "package:phlo-superset",
        "service:polaris",
        "service:polaris-bootstrap",
        "service:airbyte",
        "service:kafka",
        "service:postgres-exporter",
        "service:alloy",
        "service:alloy-docker",
        "service:airbyte-temporal",
        "service:airbyte-manifest",
        "service:airbyte-bootloader",
        "service:grafana",
        "service:loki",
        "service:loki-setup",
        "service:prometheus",
        "service:prometheus-setup",
        "service:clickhouse",
        "service:clickhouse-setup",
        "service:rustfs",
        "service:rustfs-setup",
        "service:rustfs-volume-setup",
        "service:openmetadata",
        "service:openmetadata-setup",
        "service:openmetadata-mysql",
        "service:openmetadata-elasticsearch",
        "service:superset",
        "service:clickstack",
        "service:phlo-observer",
        "service:phlo-observer-db-setup"
      ],
      "reason": "These alternatives are outside the tested v1 support boundary."
    },
    "development_only": {
      "status": "local_or_test_use",
      "components": [
        "package:phlo-observatory-example",
        "package:phlo-pgweb",
        "package:phlo-testing",
        "package:phlo-transform",
        "service:pgweb"
      ],
      "reason": "These surfaces support local development or testing and do not establish a production deployment guarantee."
    }
  },
  "packages": [
    {
      "name": "phlo",
      "scope": "blessed_core",
      "target_status": "supported",
      "current_maturity": "alpha",
      "reason": "Current package code and focused tests substantiate the v1-target capability; the shared release gates still control readiness.",
      "evidence": [
        "pyproject.toml",
        "tests/cli",
        "tests/runtime"
      ]
    },
    {
      "name": "phlo-api",
      "scope": "blessed_core",
      "target_status": "supported",
      "current_maturity": "alpha",
      "reason": "API and Observatory integration are implemented and tested, but mandatory authorization remains a release gate.",
      "evidence": [
        "packages/phlo-api/pyproject.toml",
        "packages/phlo-api/tests",
        "registry/support/dependency-qualification.md#fastapi-and-pyiceberg-deferrals"
      ]
    },
    {
      "name": "phlo-core-plugins",
      "scope": "blessed_core",
      "target_status": "supported",
      "current_maturity": "alpha",
      "reason": "Current package code and focused tests substantiate the v1-target capability; the shared release gates still control readiness.",
      "evidence": [
        "packages/phlo-core-plugins/pyproject.toml",
        "packages/phlo-core-plugins/tests"
      ]
    },
    {
      "name": "phlo-dagster",
      "scope": "blessed_core",
      "target_status": "supported",
      "current_maturity": "alpha",
      "reason": "Current package code and focused tests substantiate the v1-target capability; the shared release gates still control readiness.",
      "evidence": [
        "packages/phlo-dagster/pyproject.toml",
        "packages/phlo-dagster/tests"
      ]
    },
    {
      "name": "phlo-dbt",
      "scope": "blessed_core",
      "target_status": "supported",
      "current_maturity": "alpha",
      "reason": "Current package code and focused tests substantiate the v1-target capability; the shared release gates still control readiness.",
      "evidence": [
        "packages/phlo-dbt/pyproject.toml",
        "packages/phlo-dbt/tests"
      ]
    },
    {
      "name": "phlo-dlt",
      "scope": "blessed_core",
      "target_status": "supported",
      "current_maturity": "alpha",
      "reason": "dlt ingestion is part of the current core path and has focused tests; run-evidence correlation is not included in this manifest version.",
      "evidence": [
        "packages/phlo-dlt/pyproject.toml",
        "packages/phlo-dlt/tests",
        "registry/support/dependency-qualification.md#arrow-26-with-pyiceberg-dlt-and-pandas"
      ]
    },
    {
      "name": "phlo-iceberg",
      "scope": "blessed_core",
      "target_status": "supported",
      "current_maturity": "alpha",
      "reason": "Current package code and focused tests substantiate the v1-target capability; the shared release gates still control readiness.",
      "evidence": [
        "packages/phlo-iceberg/pyproject.toml",
        "packages/phlo-iceberg/tests",
        "registry/support/dependency-qualification.md#arrow-26-with-pyiceberg-dlt-and-pandas",
        "registry/support/dependency-qualification.md#fastapi-and-pyiceberg-deferrals"
      ]
    },
    {
      "name": "phlo-minio",
      "scope": "blessed_core",
      "target_status": "supported",